{
  "name": "@agenticprimitives/tool-policy",
  "kind": "capability",
  "stability": "experimental",
  "agentEntry": "CLAUDE.md",
  "publicEntry": "src/index.ts",
  "specEntry": "../../specs/204-tool-policy.md",
  "summary": "Protocol-agnostic classification taxonomy + risk tiers + exact-call DSL + decision engine. Consumable by any tool runtime.",
  "owns": {
    "source": ["src/**"],
    "tests": ["test/**"]
  },
  "imports": [
    "@agenticprimitives/types"
  ],
  "allowedImports": [
    "@agenticprimitives/types",
    "@noble/hashes"
  ],
  "forbiddenImports": [
    "apps/*",
    "@agenticprimitives/connect-auth",
    "@agenticprimitives/agent-account",
    "@agenticprimitives/key-custody",
    "@agenticprimitives/mcp-runtime",
    "@modelcontextprotocol/sdk",
    "@a2aproject/a2a-js",
    "langchain",
    "@langchain/core",
    "ai",
    "@vercel/ai",
    "@agenticprimitives/agent-naming",
    "@agenticprimitives/agent-profile",
    "@agenticprimitives/agent-relationships"
  ],
  "publicExports": [
    "RiskTier",
    "ToolClassification",
    "ExactCallPolicy",
    "PolicyContext",
    "PolicyDecision",
    "CaveatContext",
    "CaveatLike",
    "DelegationLike",
    "declareTool",
    "exactCall",
    "matchesExactCall",
    "evaluatePolicy",
    "clampTtlForRiskTier",
    "requiredCaveatsForRiskTier",
    "lintClassification",
    "LintResult",
    "Address",
    "Hex",
    "ThresholdTier",
    "ThresholdPolicyDecision",
    "evaluateThresholdPolicy",
    "RISK_TIER_REQUIREMENTS"
  ],
  "forbiddenTerms": [
    { "term": "@modelcontextprotocol", "reason": "Protocol-agnostic. Importing MCP SDK violates ADR-0003.", "owningPackage": "@agenticprimitives/mcp-runtime" },
    { "term": "a2a-js", "reason": "Protocol-agnostic. ADR-0003.", "owningPackage": "future @agenticprimitives/a2a-runtime" },
    { "term": "langchain", "reason": "Protocol-agnostic. ADR-0003." },
    { "term": "@langchain", "reason": "Protocol-agnostic. ADR-0003." },
    { "term": "@vercel/ai", "reason": "Protocol-agnostic. ADR-0003." },
    { "term": "withDelegation", "reason": "MCP wrapper belongs in mcp-runtime.", "owningPackage": "@agenticprimitives/mcp-runtime", "allowInPaths": ["src/types.ts", "src/risk-tier.ts", "spec.md", "README.md", "CLAUDE.md", "AUDIT.md"] },
    { "term": "DelegationClient", "reason": "Belongs in delegation.", "owningPackage": "@agenticprimitives/delegation" },
    { "term": "SessionManager", "reason": "Belongs in delegation.", "owningPackage": "@agenticprimitives/delegation" },
    { "term": "A2AKeyProvider", "reason": "Belongs in key-custody.", "owningPackage": "@agenticprimitives/key-custody" },
    { "term": "envelope encryption", "reason": "Belongs in key-custody.", "owningPackage": "@agenticprimitives/key-custody" },
    { "term": "JTI", "reason": "Belongs in delegation/mcp-runtime.", "owningPackage": "@agenticprimitives/delegation" },
    { "term": "passkey", "reason": "Auth method; belongs in identity-auth. tool-policy may reference the term in cross-cutting-capability docs for spec 207 mappings (UV gate, multi-passkey recovery).", "owningPackage": "@agenticprimitives/connect-auth", "allowInPaths": ["src/types.ts", "src/risk-tier.ts", "spec.md", "README.md", "CLAUDE.md", "AUDIT.md"] },
    { "term": "JWT", "reason": "Session mechanism; belongs in identity-auth.", "owningPackage": "@agenticprimitives/connect-auth", "allowInPaths": ["spec.md", "README.md"] },
    { "term": "OAuth", "reason": "Auth method; belongs in identity-auth.", "owningPackage": "@agenticprimitives/connect-auth" }
  ],
  "ignoreForAgentContext": [
    "dist/**",
    "node_modules/**",
    "coverage/**",
    "*.tsbuildinfo"
  ],
  "contextBudget": {
    "claudeMdMaxWords": 1200,
    "readmeMaxWords": 1800,
    "architectureMaxWords": 3000
  }
}
