{
  "name": "@agenticprimitives/delegation",
  "kind": "capability",
  "stability": "experimental",
  "agentEntry": "CLAUDE.md",
  "publicEntry": "src/index.ts",
  "specEntry": "../../specs/202-delegation.md",
  "summary": "EIP-712 delegations spanning web app → agent → MCP. Caveats, token envelope, validation, session lifecycle.",
  "owns": {
    "source": [
      "src/**"
    ],
    "tests": [
      "test/**"
    ]
  },
  "imports": [
    "@agenticprimitives/types",
    "@agenticprimitives/audit",
    "@agenticprimitives/connect-auth",
    "@agenticprimitives/agent-account",
    "@agenticprimitives/key-custody"
  ],
  "allowedImports": [
    "@agenticprimitives/types",
    "@agenticprimitives/audit",
    "@agenticprimitives/connect-auth",
    "@agenticprimitives/agent-account",
    "@agenticprimitives/key-custody",
    "viem",
    "@noble/curves",
    "@noble/hashes"
  ],
  "forbiddenImports": [
    "apps/*",
    "@agenticprimitives/tool-policy",
    "@agenticprimitives/mcp-runtime",
    "@agenticprimitives/agent-naming",
    "@agenticprimitives/agent-profile",
    "@agenticprimitives/agent-relationships"
  ],
  "publicExports": [
    "ROOT_AUTHORITY",
    "buildCaveat",
    "buildMcpToolScopeCaveat",
    "buildDataScopeCaveat",
    "buildDelegateBindingCaveat",
    "buildQuorumCaveat",
    "encodeTimestampTerms",
    "encodeValueTerms",
    "encodeAllowedTargetsTerms",
    "encodeAllowedMethodsTerms",
    "encodeCallDataHashTerms",
    "MCP_TOOL_SCOPE_ENFORCER",
    "DATA_SCOPE_ENFORCER",
    "DELEGATE_BINDING_ENFORCER",
    "QuorumCaveatOpts",
    "hashDelegation",
    "SessionDelegationParams",
    "buildSessionDelegation",
    "hashCaveats",
    "DELEGATION_EIP712_TYPES",
    "delegationDomain",
    "evaluateCaveats",
    "DelegationClient",
    "SessionManager",
    "createMemorySessionStore",
    "verifyAuthorization",
    "VerifyAuthorizationResult",
    "mintDelegationToken",
    "verifyDelegationToken",
    "isRevoked",
    "Address",
    "Hex",
    "Caveat",
    "CaveatContext",
    "CaveatVerdict",
    "Delegation",
    "DataScopeGrant",
    "DelegationClientOpts",
    "DelegationTokenClaims",
    "EnforcerAddressMap",
    "EvaluateOpts",
    "JtiStore",
    "SessionMeta",
    "SessionPackage",
    "SessionRow",
    "SessionStore",
    "TxContext",
    "VerifyError",
    "VerifyOpts",
    "VerifyOptsExt",
    "sessionDelegateBindingError",
    "PAYMENT_TRANSFER_SELECTOR",
    "encodePaymentTerms",
    "buildPaymentMandateCaveats",
    "describePaymentMandate",
    "PaymentMandateCaveatOpts",
    "PaymentMandateConsent",
    "buildRevokeDelegationCall"
  ],
  "forbiddenTerms": [
    {
      "term": "LocalAesProvider",
      "reason": "Concrete KMS backend belongs in key-custody. Use the A2AKeyProvider interface here.",
      "owningPackage": "@agenticprimitives/key-custody"
    },
    {
      "term": "AwsKmsProvider",
      "reason": "Concrete KMS backend belongs in key-custody.",
      "owningPackage": "@agenticprimitives/key-custody"
    },
    {
      "term": "GcpKmsProvider",
      "reason": "Concrete KMS backend belongs in key-custody.",
      "owningPackage": "@agenticprimitives/key-custody"
    },
    {
      "term": "AES-GCM",
      "reason": "Encryption algorithm specifics belong in key-custody. Permitted in session-manager.ts (the documented bridge: delegation drives the payload-layer encryption using a data key from key-custody; v0.1 may push this primitive into key-custody itself).",
      "owningPackage": "@agenticprimitives/key-custody",
      "allowInPaths": [
        "src/session-manager.ts",
        "test/integration/session-manager.test.ts",
        "spec.md",
        "README.md",
        "CLAUDE.md"
      ]
    },
    {
      "term": "AAD",
      "reason": "AAD shape is delegation's choice but AAD encoding is key-custody's. Permitted in session-manager.ts as parameter names + comments.",
      "owningPackage": "@agenticprimitives/key-custody",
      "allowInPaths": [
        "src/session-manager.ts",
        "test/integration/session-manager.test.ts",
        "spec.md",
        "README.md",
        "CLAUDE.md"
      ]
    },
    {
      "term": "RiskTier",
      "reason": "Policy taxonomy belongs in tool-policy. Consume requiredCaveatsForRiskTier from there; don't redefine levels.",
      "owningPackage": "@agenticprimitives/tool-policy",
      "allowInPaths": [
        "spec.md",
        "README.md"
      ]
    },
    {
      "term": "evaluatePolicy",
      "reason": "Decision engine belongs in tool-policy.",
      "owningPackage": "@agenticprimitives/tool-policy"
    },
    {
      "term": "withDelegation",
      "reason": "MCP wrapper belongs in mcp-runtime. delegation may reference the term in cross-cutting-capability docstrings (spec 207 threshold-policy gates).",
      "owningPackage": "@agenticprimitives/mcp-runtime",
      "allowInPaths": [
        "src/caveats.ts",
        "src/token.ts",
        "spec.md",
        "README.md",
        "CLAUDE.md",
        "AUDIT.md"
      ]
    },
    {
      "term": "@modelcontextprotocol",
      "reason": "MCP transport is mcp-runtime's concern.",
      "owningPackage": "@agenticprimitives/mcp-runtime"
    },
    {
      "term": "passkey",
      "reason": "Auth method internals belong in connect-auth.",
      "owningPackage": "@agenticprimitives/connect-auth",
      "allowInPaths": [
        "spec.md",
        "README.md",
        "CLAUDE.md"
      ]
    },
    {
      "term": "SIWE",
      "reason": "Auth method belongs in connect-auth.",
      "owningPackage": "@agenticprimitives/connect-auth",
      "allowInPaths": [
        "spec.md",
        "README.md"
      ]
    }
  ],
  "ignoreForAgentContext": [
    "dist/**",
    "node_modules/**",
    "coverage/**",
    "*.tsbuildinfo",
    "test/fixtures/golden/**"
  ],
  "contextBudget": {
    "claudeMdMaxWords": 1500,
    "readmeMaxWords": 1800,
    "architectureMaxWords": 3000
  }
}
