{
  "name": "@agenticprimitives/identity-auth",
  "kind": "capability",
  "stability": "experimental",
  "agentEntry": "CLAUDE.md",
  "publicEntry": "src/index.ts",
  "specEntry": "../../specs/200-identity-auth.md",
  "summary": "User auth (passkey + SIWE + Google OAuth), JWT sessions, CSRF, and pluggable Signer interfaces consumed by agent-account and delegation.",
  "owns": {
    "source": ["src/**"],
    "tests": ["test/**"]
  },
  "imports": [
    "@agenticprimitives/types"
  ],
  "allowedImports": [
    "@agenticprimitives/types",
    "viem",
    "@noble/curves",
    "@noble/hashes"
  ],
  "forbiddenImports": [
    "apps/*",
    "@agenticprimitives/agent-account",
    "@agenticprimitives/delegation",
    "@agenticprimitives/key-custody",
    "@agenticprimitives/tool-policy",
    "@agenticprimitives/mcp-runtime"
  ],
  "publicExports": [
    "mintSession",
    "verifySession",
    "SESSION_COOKIE",
    "SESSION_TTL_SECONDS",
    "csrfTokenFor",
    "verifyCsrf",
    "deriveSaltFromLabel",
    "deriveSaltFromEmail",
    "Signer",
    "PasskeySigner",
    "EOASigner",
    "KMSSigner",
    "JwtClaims",
    "AuthenticatedUser",
    "AuthMethod"
  ],
  "ignoreForAgentContext": [
    "dist/**",
    "node_modules/**",
    "coverage/**",
    "*.tsbuildinfo"
  ],
  "contextBudget": {
    "claudeMdMaxWords": 900,
    "readmeMaxWords": 1800,
    "architectureMaxWords": 3000
  }
}
