{
  "name": "@agenticprimitives/fedcm-rp",
  "kind": "adapter",
  "stability": "experimental",
  "agentEntry": "CLAUDE.md",
  "publicEntry": "src/index.ts",
  "specEntry": "../../specs/264-fedcm-idp-adapter.md",
  "summary": "Relying-party FedCM wrapper: navigator.credentials.get({identity}) → IdP token. The FedCM strategy injected into browser-identity's chooseSignIn. Post-145; thin bootstrap, not authority (ADR-0031).",
  "owns": {
    "source": ["src/**"],
    "tests": ["test/**"]
  },
  "imports": [],
  "allowedImports": [],
  "forbiddenImports": [
    "apps/*",
    "@agenticprimitives/connect-auth",
    "@agenticprimitives/agent-account",
    "@agenticprimitives/agent-naming",
    "@agenticprimitives/agent-profile",
    "@agenticprimitives/agent-relationships",
    "@agenticprimitives/key-custody",
    "@agenticprimitives/delegation",
    "@agenticprimitives/mcp-runtime",
    "@modelcontextprotocol/sdk",
    "@a2aproject/a2a-js",
    "langchain",
    "@langchain/core",
    "ai",
    "@vercel/ai"
  ],
  "publicExports": [
    "FedcmProvider",
    "FedcmGetOptions",
    "FedcmResult",
    "fedcmSupported",
    "fedcmGet"
  ],
  "forbiddenTerms": [
    { "term": "@modelcontextprotocol", "reason": "Transport-agnostic. ADR-0003." },
    { "term": "a2a-js", "reason": "Transport-agnostic. ADR-0003." },
    { "term": "langchain", "reason": "Transport-agnostic. ADR-0003." },
    { "term": "@vercel/ai", "reason": "Transport-agnostic. ADR-0003." },
    { "term": "impact-agent.me", "reason": "Concrete hostname; the consumer supplies configURL/origins. ADR-0021.", "owningPackage": "apps/*" }
  ],
  "ignoreForAgentContext": [
    "dist/**",
    "node_modules/**",
    "coverage/**",
    "*.tsbuildinfo"
  ],
  "contextBudget": {
    "claudeMdMaxWords": 1200,
    "readmeMaxWords": 1800,
    "architectureMaxWords": 3000
  }
}
